Elephantopus scaber,Controversial,In Gujarat there is a plant known as Galajibhi or Gojobhi which exactly corresponds with Gojihva; This is correlated to Elephantopus scaber; With regard to Gojihva having hirsute rough leaves this species has smooth leaves so cannot be totally considered,364,Gojihva,गोजिह्वा,gojihvā
Launaea sp.,Accepted source,Gojihva mentioned in the samhitas is correlated to the given species which is known as 'Bangobhi'; Based on this Bhavamisra has given the synonym 'Gobhi' to it,364,Gojihva,गोजिह्वा,gojihvā
Macrotomia benthamii DC.,Controversial,Eventhough it is correlated to some other species this species is used as Gojihva,364,Gojihva,गोजिह्वा,gojihvā
Macrotomia benthamii DC.,Controversial,Eventhough it is correlated to some other species this species is used as Gojihva,364,Gojihva,गोजिह्वा,gojihvā
Onosma bracteatum,Accepted source,Gojihva is correlated to this species,364,Gojihva,गोजिह्वा,gojihvā
Onosma bracteatum Wall.,Accepted source,Gojihva is correlated to this species,364,Gojihva,गोजिह्वा,gojihvā
Onosma bracteatum Wall.,Most probable,Most probably it is identified with this species,364,Gojihva,गोजिह्वा,gojihvā
Acanthospermum hispidum DC.,Most probable,As this species has features similar to this plant it may have been used as Goksura,365,Goksura,गोक्षुर,gokṣura
Pedalium murex Linn.,Most probable,This species is used as this plant has features similar to it,365,Goksura,गोक्षुर,gokṣura
Tribulus terrestris Linn.,Accepted source,Identified with it,365,Goksura,गोक्षुर,gokṣura
Tribulus terrestris Linn.,Accepted source,Identified with it,365,Goksura,गोक्षुर,gokṣura
Acanthospermum hispidum DC.,Most probable,As this species has features similar to this plant it may have been used as Goksura,365,Goksura,गोक्षुर,gokṣura
Pedalium murex Linn.,Most probable,This species is used as this plant has features similar to it,365,Goksura,गोक्षुर,gokṣura
Tribulus terrestris Linn.,Accepted source,Identified with it,365,Goksura,गोक्षुर,gokṣura
Tribulus terrestris Linn.,Accepted source,Identified with it,365,Goksura,गोक्षुर,gokṣura
Acanthospermum hispidum DC.,Most probable,As this species has features similar to this plant it may have been used as Goksura,365,Goksura,गोक्षुर,gokṣura
Pedalium murex Linn.,Most probable,This species is used as this plant has features similar to it,365,Goksura,गोक्षुर,gokṣura
Tribulus terrestris Linn.,Accepted source,Identified with it,365,Goksura,गोक्षुर,gokṣura
Tribulus terrestris Linn.,Accepted source,Identified with it,365,Goksura,गोक्षुर,gokṣura
Martynia diandra,Suggested source,Goksuru literally means the hoof of a cow; So some suggested this species as Goksura as its fruit is cleft like a cows hook and has 3 hooks; So in real sense this is the real Goksura but cannot be taken into consideration as this is an exotic plant,367,Goksuru,गोक्षुरु,gokṣuru
Tribulus terrestris,Accepted source,Goksura is correlated to this species,367,Goksuru,गोक्षुरु,gokṣuru
Martynia diandra,Suggested source,Goksuru literally means the hoof of a cow; So some suggested this species as Goksura as its fruit is cleft like a cows hook and has 3 hooks; So in real sense this is the real Goksura but cannot be taken into consideration as this is an exotic plant,367,Goksuru,गोक्षुरु,gokṣuru
Tribulus terrestris,Accepted source,Goksura is correlated to this species,367,Goksuru,गोक्षुरु,gokṣuru
Martynia diandra,Suggested source,Goksuru literally means the hoof of a cow; So some suggested this species as Goksura as its fruit is cleft like a cows hook and has 3 hooks; So in real sense this is the real Goksura but cannot be taken into consideration as this is an exotic plant,367,Goksuru,गोक्षुरु,gokṣuru
Tribulus terrestris,Accepted source,Goksura is correlated to this species,367,Goksuru,गोक्षुरु,gokṣuru
Tribulus terrestris,Accepted source,Laghu goksura is correlated to this species,369,Goksuru - laghu,गोक्षुरु लघु,gokṣuru laghu
Tribulus terrestris,Accepted source,Laghu goksura is correlated to this species,369,Goksuru - laghu,गोक्षुरु लघु,gokṣuru laghu
Tribulus terrestris,Accepted source,Laghu goksura is correlated to this species,369,Goksuru - laghu,गोक्षुरु लघु,gokṣuru laghu
Pedalium murex,Accepted source,Big variety of Goksura is correlated to this species,368,Goksuru - brhat,गोक्षुरु बॄहत्,gokṣuru bṝhat
Xanthium strumarium Linn.,Most probable,This species is used as Goksura in Punjab and Sindh,368,Goksuru - brhat,गोक्षुरु बॄहत्,gokṣuru bṝhat
Pedalium murex,Accepted source,Big variety of Goksura is correlated to this species,368,Goksuru - brhat,गोक्षुरु बॄहत्,gokṣuru bṝhat
Xanthium strumarium Linn.,Most probable,This species is used as Goksura in Punjab and Sindh,368,Goksuru - brhat,गोक्षुरु बॄहत्,gokṣuru bṝhat
Pedalium murex Linn.,Accepted source,It is the bigger variety of Goksura which is correlated to this species,366,Goksura - brhat,गोक्षुर बॄहत्,gokṣura bṝhat
Pedalium murex Linn.,Accepted source,It is the bigger variety of Goksura which is correlated to this species,366,Goksura - brhat,गोक्षुर बॄहत्,gokṣura bṝhat
Umbelliferae - aromatic plants,Suggested source,May be an alternative source of Golomi,370,Golomi,गोलोमी,golomī
Launae sp.,Accepted source,Identified with this species,371,Golomika,गोलोमिका,golomikā
Arisaema sp.,Most probable,The source may be identified with this plant with regard to its popular name Gunasa or Mahagunasa in Kashmir,372,Gonasi,गोनसी,gonasī
Arisaema Sp.,Most probable,Gonasi' is mentioned in Susruta as a divya aushadhi (divine drug) and most probably correlated to this species,372,Gonasi,गोनसी,gonasī
Cyamopsis tetragonaloba (Linn.) Taub.,Accepted source,It is identified with this species,373,Gopasimbi,गोपशिम्बी,gopaśimbī
Ichnocarpus frutescens R. Br.,Accepted source,Identified with this species,374,Gopavalli,गोपवल्ली,gopavallī
Dalbergia lanceolaria Linn.,Accepted source,Identified with this species,375,Goraksa,गोरक्ष,gorakṣa
Euphorbia thymifolia,Accepted source,Identified with this species,376,Goraksadugdhi,गोरक्षदुग्धी,gorakṣadugdhī
Aerva lanata Juss.,Accepted source,Identified with this species,377,Goraksaganja,गोरक्षगांजा,gorakṣagāṃjā
Adansonia digitata Linn.,Accepted source,Goraksi is identified with this species,378,Goraksi,गोरक्षी,gorakṣī
Betula sp.,Most probable,The fungal formations on Betula species is considered as Granthi (a knot like structure formed by plants parts or tissues),379,Granthi,ग्रन्थि,granthi
Nelumbium sp.,Most probable,Granthi is used as a synonym for many plants and as this species has rhizomes which is the feature of Granthi it is correlated to it,379,Granthi,ग्रन्थि,granthi
Premna herbacea Roxb.,Most probable,Roots have similar appaearance with the features described for Granthi hence correlated,379,Granthi,ग्रन्थि,granthi
Brassica oleracea var. gummifera DC.,Accepted source,It is identified with this species,380,Granthigobhi - prakara,ग्रन्थिगोभी प्रकार,granthigobhī prakāra
Angelica glauca,Controversial,If Granthiparna is considered as Coraka then it can be correlated to this species; but there is a doubt whether Granthiparna and Coraka are one and the same or two distinct plants,381,Granthiparna,ग्रन्थिपर्ण,granthiparṇa
Brassica oleracea var. gongylods Linn.,Accepted source,It is identified with this species,381,Granthiparna,ग्रन्थिपर्ण,granthiparṇa
Clerodendron infortunatum Linn.,Controversial,Granthiparna still remains controversial; Some consider this species to be Granthiparna,381,Granthiparna,ग्रन्थिपर्ण,granthiparṇa
Taxus baccata Linn.,Accepted source,Variety of Granthiparna i.e. Sthauneyaka is identifiedwith this species,381,Granthiparna,ग्रन्थिपर्ण,granthiparṇa
Abies pindrow Royle,Most probable,In Rajanighantu this appears as a synonym of 'Coraka'; Dalhana and Bhavaprakasa nighantu share the same view where in 'Coraka' is described as a type of 'Granthiparna bheda' (with regard to similarity in features) and 'Sthauneyaka' as 'Granthiparna'; 'Sthauneyaka' and 'Talisa' are similar in features hence correlated to a species of 'Talisa',382,Granthiparni,ग्रन्थिपर्णी,granthiparṇī
Angelica sp.,Most probable,May be identified as this species,383,Granthiparnika,ग्रन्थिपर्णिका,granthiparṇikā
Valeriana sp.,Most probable,May be identified as this species,383,Granthiparnika,ग्रन्थिपर्णिका,granthiparṇikā
Capparis zeylanica Linn.,Most probable,May be considered as this species,384,Grdhranakhi,गृध्रनखी,gṛdhranakhī
Zizyphus jujuba Lam. var. fruticosa Haines,Most probable,May be considered as this species,384,Grdhranakhi,गृध्रनखी,gṛdhranakhī
Allium ascalonicum Linn.,Most probable,Most probably correlated to this species,385,Grnja,गृञ्ज,gṛñja
Allium ascalonicum Linn.,Accepted source,Grnjanaka' is identified with this species,386,Grnjanaka,गृञ्जनक,gṛñjanaka
Brassica campestris,Accepted source,Grnjanaka is correlated to this species,386,Grnjanaka,गृञ्जनक,gṛñjanaka
Daucus carota,Accepted source,Garjara is correlated to this species,386,Grnjanaka,गृञ्जनक,gṛñjanaka
Eulophia campestris,Suggested source,V G Desai has identified Grnjanaka as 'Baadshahi saalam'; With regard to its properties and its name 'Lasaniya saalam' he has correlated Grnjanaka to this species,386,Grnjanaka,गृञ्जनक,gṛñjanaka
Moringa pterygosperma,Controversial,Grnjanaka is a highly controversial plant; With regard to the commentary given by Cakrapani it may be Sigru which is correlated to this species,386,Grnjanaka,गृञ्जनक,gṛñjanaka
Orchis mascula,Suggested source,V G Desai has identified Grnjanaka as a type of garlic and correlated it to this species,386,Grnjanaka,गृञ्जनक,gṛñjanaka
Urginia indica,Suggested source,One of the commentator has identified Grnjana as Vanapalandu which is correlated to this species,386,Grnjanaka,गृञ्जनक,gṛñjanaka
Dioscorea bulbifera Linn.,Accepted source,Identified with it,387,Grstika,गृष्टिक,gṛṣṭika
Truffles sp.,Accepted source,It has been mentioned in Raja nighantu and identified with this species,388,Gucchahvakanda - prajati,गुच्छाह्वकन्द प्रजाति,gucchāhvakanda prajāti
Lannea grandis (Dennst.) Engl.,Accepted source,Identified with it,389,Gudamanjari,गुडमञ्जरी,guḍamañjarī
Grewia hirsuta Vahl.,Accepted source,Gudasarkara' is considered as the synonym of 'Nagabala' which is identified with this species; It has been cited once in Caraka and once in Susruta samhita,390,Gudasarkara,गुडशर्करा,guḍaśarkarā
Tinospora cordifolia (Willd) Miers ex Hook.f. & Th,Accepted source,Guduci is correlated to this species,391,Guduci,गुडूची,guḍūcī
Tinospora cordifolia (Willd.) Miers.,Accepted source,Identified with it,391,Guduci,गुडूची,guḍūcī
Cocculus hirsutus (Linn.) Diels.,Most probable,Usually considered to be a synonym of Guduci but Dalhana identifies it with another plant,1353,Vatsadani,वत्सादनी,vatsādanī
Cocculus hirsutus (Linn.) Diels.,Most probable,"In the nighantus it is mentioned as a synonym of Guduci but in the samhitas it is mentioned as an exclusive drug; It’s a type of creeper, eaten a lot by calves; Based on the above some of them consider this as 'Vasanvel' which is correlated to this species",1353,Vatsadani,वत्सादनी,vatsādanī
Tinospora crispa (Linn.) Miers ex. Hook f. & Thoms,Accepted source,This species is correlated to a variety of Guduci which is known as ‘Padmaguduci or Kandaguduci’. Leaves appear big and triangular in shape,1353,Vatsadani,वत्सादनी,vatsādanī
Tinospora sinensis (Lour.) Merill,Accepted source,This species is correlated to a variety of Guduci which is known as ‘Padmaguduci or Kandaguduci’. Leaves appear big and triangular in shape,1353,Vatsadani,वत्सादनी,vatsādanī
Tinospora sinensis (Lour.) Merill.,Accepted source,"In the nighantus, 'Vatsadani' is considered as a synonym of 'Guduci' but referance of ancient texts depict it to be a different drug from 'Guduci'; It’s a creeper which is a favourite of goats and hence its name 'Vatsadani'; In Abhidhanaratnamala, 'Vatsadani' is mentioned under the group of sweet drugs and 'Guduci' under the group of bitter drugs but there is also a mention of 'Vatsadani' as a synonym of 'Guduci' which shows that it should be variety of 'Guduci' hence identified with this species and which is popularly known as 'Padmaguduci'",1353,Vatsadani,वत्सादनी,vatsādanī
Cocculus hirsutus (Linn.) Diels.,Most probable,Usually considered to be a synonym of Guduci but Dalhana identifies it with another plant,1353,Vatsadani,वत्सादनी,vatsādanī
Cocculus hirsutus (Linn.) Diels.,Most probable,"In the nighantus it is mentioned as a synonym of Guduci but in the samhitas it is mentioned as an exclusive drug; It’s a type of creeper, eaten a lot by calves; Based on the above some of them consider this as 'Vasanvel' which is correlated to this species",1353,Vatsadani,वत्सादनी,vatsādanī
Tinospora crispa (Linn.) Miers ex. Hook f. & Thoms,Accepted source,This species is correlated to a variety of Guduci which is known as ‘Padmaguduci or Kandaguduci’. Leaves appear big and triangular in shape,1353,Vatsadani,वत्सादनी,vatsādanī
Tinospora sinensis (Lour.) Merill,Accepted source,This species is correlated to a variety of Guduci which is known as ‘Padmaguduci or Kandaguduci’. Leaves appear big and triangular in shape,1353,Vatsadani,वत्सादनी,vatsādanī
Tinospora sinensis (Lour.) Merill.,Accepted source,"In the nighantus, 'Vatsadani' is considered as a synonym of 'Guduci' but referance of ancient texts depict it to be a different drug from 'Guduci'; It’s a creeper which is a favourite of goats and hence its name 'Vatsadani'; In Abhidhanaratnamala, 'Vatsadani' is mentioned under the group of sweet drugs and 'Guduci' under the group of bitter drugs but there is also a mention of 'Vatsadani' as a synonym of 'Guduci' which shows that it should be variety of 'Guduci' hence identified with this species and which is popularly known as 'Padmaguduci'",1353,Vatsadani,वत्सादनी,vatsādanī
Tinospora crispa (Linn.) Miers ex. Hook f. & Thoms,Accepted source,This species is correlated to a variety of Guduci which is known as ‘Padmaguduci or Kandaguduci’. Leaves appear big and triangular in shape,392,Guduci – jati,गुडूची जाति,guḍūcī jāti
Tinospora sinensis (Lour.) Merill,Accepted source,This species is correlated to a variety of Guduci which is known as ‘Padmaguduci or Kandaguduci’. Leaves appear big and triangular in shape,392,Guduci – jati,गुडूची जाति,guḍūcī jāti
Tinospora crispa (Linn.) Miers ex. Hook f. & Thoms,Accepted source,This species is correlated to a variety of Guduci which is known as ‘Padmaguduci or Kandaguduci’. Leaves appear big and triangular in shape,392,Guduci – jati,गुडूची जाति,guḍūcī jāti
Tinospora sinensis (Lour.) Merill,Accepted source,This species is correlated to a variety of Guduci which is known as ‘Padmaguduci or Kandaguduci’. Leaves appear big and triangular in shape,392,Guduci – jati,गुडूची जाति,guḍūcī jāti
Commiphora mukul (Hook ex Stocks) Engl.,Accepted source,Identified with it,393,Guggulu,गुग्गुलु,guggulu
Commiphora mukul (Hook. ex Stocks) Engl.,Accepted source,Identified with it,393,Guggulu,गुग्गुलु,guggulu
Balsamodendron stocksiana Engl.,Accepted source,Identified with it,394,Guggulu - mahisaksa,गुग्गुलु महिषाक्ष,guggulu mahiṣākṣa
Commiphora roxburghii (Arn.) Engl.,Accepted source,It is another variety of Commiphora found in Assam and Madhya Pradesh.Guggulu is correlated to this species,395,Guggulu - prajati,गुग्गुलु प्रजाति,guggulu prajāti
Bacopa monniera,Controversial,Is an aquatic plant which some relate to Jalaneem correlated to this species,396,Gundala,गुण्डाल,guṇḍāla
Typha elephantina Roxb.,Accepted source,Identified with it,397,Gundra,गुन्द्र,gundra
Typha elephantina Roxb.,Accepted source,Its identified with this species,397,Gundra,गुन्द्र,gundra
Abrus precatorius Linn.,Accepted source,Identified with it,398,Gunja,गुञ्जा,guñjā
Abrus precatorius Linn.,Accepted source,Identified with it,398,Gunja,गुञ्जा,guñjā
Abrus pulchellum Wall.,Suggested source,May be identified with this species,399,Gunja - visa,गुञ्जा विष,guñjā viṣa
Cardiospermum halicacabum Linn.,Suggested source,Needs to be examined,399,Gunja - visa,गुञ्जा विष,guñjā viṣa
Fimbristylis sp.,Most probable,May indicate this species as it has features resembling the plant,400,Guntha,गुण्ठ,guṇṭha
Typha angustata Bory & Chaub.,Most probable,"May be considered as this species, as according to Bhavamisra Gundra is 'Pateraka' which is this species",400,Guntha,गुण्ठ,guṇṭha
Typha australis Schum. & Thom.,Accepted source,Its identified with this species,400,Guntha,गुण्ठ,guṇṭha
Iris ensata Thunb.,Accepted source,It is identified with this species,401,Haimavati,हैमवती,haimavatī
Iris sp.,Accepted source,It is identified with this species,401,Haimavati,हैमवती,haimavatī
Paris polyphylla sm.,Accepted source,Its identified with this species,401,Haimavati,हैमवती,haimavatī
Iris germanica Linn.,Accepted source,This variety is imported from Iran but now cultivated in Kashmir,402,Haimavati - prajati,हैमवती प्रजाति,haimavatī prajāti
Iris nepalensis D. Don.,Accepted source,Is a variety of Iris found in the Himalayan regions,402,Haimavati - prajati,हैमवती प्रजाति,haimavatī prajāti
Adianthum lunulatum Burn.,Accepted source,Identified with it,403,Hamsapadi,हंसपादी,haṃsapādī
Adiantum lunulatum Burm.,Accepted source,Hamsapadi is correlated to this species,403,Hamsapadi,हंसपादी,haṃsapādī
Hydrocotyle asiatica,Most probable,"Kaviraja Gangadhar has identified Hamsapadi as Thulakudi, which is a Bengali name and identified with this species",403,Hamsapadi,हंसपादी,haṃsapādī
Casearia esculenta Roxb.,Most probable,Is taken into consideration as the actions of this plant matches with that of the given species,404,Hapusa,हपुषा,hapuṣā
Casearia tomentosa Roxb.,Most probable,Is taken into consideration as the features of this plant resembles with the given species,404,Hapusa,हपुषा,hapuṣā
Juniperus communis Linn.,Most probable,May be identified with it,404,Hapusa,हपुषा,hapuṣā
Juniperus communis Linn.,Most probable,May be identified with it,404,Hapusa,हपुषा,hapuṣā
Juniperus macropoda Boiss.,Most probable,May be identified with it,404,Hapusa,हपुषा,hapuṣā
Juniperus macropoda Boiss.,Accepted source,Is a variety of Juniperus communis which is a big tree.Hapusa is correlated to this species,405,Hapusa - prajati,हपुषा प्रजाति,hapuṣā prajāti
Lawsonia inermis Linn.,Substituted source,Has been recommended to be used in its place,406,Harenu,हरेणु,hareṇu
Piper aurantiacum Wall.,Substituted source,Has been recommended to be used in its place,406,Harenu,हरेणु,hareṇu
Piper aurantiacum Wall.,Suggested source,Pharmalogical and therapeutical aspects have to be worked upon and then come to a conclusion to the correlation,406,Harenu,हरेणु,hareṇu
Symphorema polyandrum Wight.,Suggested source,Has been considered as its fruits resemble Harenu in size and shape and it has similar actions when compared to this plant.,406,Harenu,हरेणु,hareṇu
Vitex agnus-castus Linn.,Substituted source,Has been recommended to be used in its place,406,Harenu,हरेणु,hareṇu
Vitex negundo Linn.,Substituted source,Has been recommended to be used in its place,406,Harenu,हरेणु,hareṇu
Amomum subulatum Roxb.,Accepted source,In Susruta samhita it is mentioned under the pippalyadi and eladi varga along with 'Ela'; Vagbhata has not mentioned 'Harenuka' but cites' Elayugma'. Agurvadi taila mentioned in Caraka has 'Harenuka' and 'Ela' as the ingredient where in Vagbhata has mentioned them as 'Eladvaya'; All the above point that 'Harenuka' is a type of 'Ela' and hence correlated to this species,407,Harenuka,हरेणुका,hareṇukā
Syzygium aromaticum (Linn.) Merr. & L.M.Perry.,Accepted source,Haricandana' is identified with this species,408,Haricandana,हरिचन्दन,haricandana
Syzygium aromaticum (Linn.) Merr. & L.M.Perry.,Accepted source,Haricandana' was the ancient name given to 'Lavanga' which is identified with this species,408,Haricandana,हरिचन्दन,haricandana
Curcuma longa Linn.,Accepted source,Identified with it,409,Haridra,हरिद्रा,haridrā
Curcuma longa Linn.,Accepted source,Identified with it,409,Haridra,हरिद्रा,haridrā
Adina cordifolia Benth & Hook.f.,,,410,Haridru,हरिद्रु,haridru
Terminalia chebula Retz.,Accepted source,Identified with it,411,Haritaki,हरितकी,haritakī
Terminalia chebula Retz.,Accepted source,Identified with it,411,Haritaki,हरितकी,haritakī
Terminalia citrina Roxb.,Accepted source,Identified with it,411,Haritaki,हरितकी,haritakī
Adina cordifolia Benth. and Hook.f.,Most probable,May be identified with it,412,Harivrksa,हरिवृक्ष,harivṛkṣa
Dioscorea sp.,Most probable,May be considered,413,Hastidanti,हस्तिदन्ती,hastidantī
Trichosanthes bracteata (Lam.) Voigt.,Most probable,May be considered,413,Hastidanti,हस्तिदन्ती,hastidantī
Leea macrophylla Roxb.,Accepted source,Identified with this species,414,Hastikanda,हस्तिकन्द,hastikanda
Leea macrophylla Roxb.,Most probable,Identified with this species,415,Hastikarna,हस्तिकर्ण,hastikarṇa
Leea macrophylla Roxb. ex Hornem.,Most probable,Most probably correlated to this species with regard to its features,415,Hastikarna,हस्तिकर्ण,hastikarṇa
Butea monosperma,Controversial,The commentator of Siddhayoga has identified Hastikarna as Palasa which is correlated to this species; according to the author it is not Palasa but has identified it with a different species,416,Hastikarnapalasa,हस्तिकर्णपलाश,hastikarṇapalāśa
Leea macrophylla,Accepted source,Hastikarnapalasa is correlated to this species,416,Hastikarnapalasa,हस्तिकर्णपलाश,hastikarṇapalāśa
Perestrophe bicaliculata,Most probable,Some identify this plant as Kakajangha which is correlated to this species,416,Hastikarnapalasa,हस्तिकर्णपलाश,hastikarṇapalāśa
Leea macrophylla Roxb.,Most probable,In Caraka it has been mentioned under the emetic drugs; Cakrapani has interpreted it as 'Morata' but the fruits are not proven to be emetic; In the above reference 'Hastiparni' is mentioned along with 'Trapusa'; In the nighantus it is mentioned as the synonym of 'Trapusa'; So this can be considered as a variety of 'Trapusa' and the fruits of 'Vanatrapusi' are emetic; Presently they have interpreted it with 'Hastikarnapalasa' which is correlated to this species but even this is not emetic,417,Hastiparni,हस्तिपर्णी,hastiparṇī
Leea macrophylla.,Accepted source,In Caraka it has been mentioned under the emetic drugs; Cakrapani has interpreted it as 'Morata'; Its name suggests that it’s a plant having leaves like the ear of an elephant so they have interpreted it as 'Hastikarnapalasa' which is identified with this species,417,Hastiparni,हस्तिपर्णी,hastiparṇī
Heliotropium sp.,Accepted source,Its identified with this species with regard to its morphology; Has been mentioned in Raja nighantu,418,Hastisundi,हस्तिशुण्डी,hastiśuṇḍī
Dioscorea sp.,Suggested source (variety),Identified with it,419,Hastyaluka,हस्त्यालुक,hastyāluka
Dendrobium macraei Lindl.,Most probable,Is mentioned in Raja nighantu; With regard to its synonyms it can most probably be correlated to this species which is widely known as 'Svarnajivanti',420,Hema,हेम,hema
Pseudo-bulb,Most probable,Hema' has been cited in Raja nighantu along with its synonyms which describes its morphology; Its synonym 'trnagranthi' depicts it to be a grass with a pseudo bulb; So most probably its some some Pseudo species,420,Hema,हेम,hema
Barringtonia acutangula,Accepted source,Hijjala is correlated to this species,421,Hijjala,हिज्जल,hijjala
